{
  "schemaVersion": "1.0.0",
  "release": {
    "mode": "published",
    "version": "0.1.0",
    "date": "2026-07-30",
    "status": "Reviewed beta · Batch 001",
    "sourceBatch": "data/releases/0.1.0/batch-001",
    "sourceWorkbook": {
      "filename": "kaykluz_africa_energy_software_map_v0_1.xlsx",
      "sha256": "fc7c75132d4b5ce27b2f113550be91ce0d9f0c420aaaaba2deac38bd196618d4"
    }
  },
  "reviewGate": {
    "assertions": 88,
    "reviewedAssertions": 88,
    "unreviewedAssertions": 0,
    "unresolvedSources": 0,
    "publishable": true
  },
  "counts": {
    "organisations": 3,
    "products": 5,
    "deployments": 4,
    "sources": 9,
    "assertions": 88
  },
  "organisations": [
    {
      "id": "org_001",
      "name": "Beacon Power Services",
      "slug": "beacon-power-services",
      "organisationType": "utility_software_scale_up",
      "originClassification": "africa_built",
      "countryOfOriginIso2": "NG",
      "headquartersCountryIso2": "",
      "lifecycleStatus": "active",
      "website": "https://beaconpowerservices.com/",
      "description": "Distribution utility digitisation, grid mapping, customer and asset systems",
      "providerProfileConfirmed": false,
      "lastCheckedAt": "2026-07-30"
    },
    {
      "id": "org_002",
      "name": "PAM Africa",
      "slug": "pam-africa",
      "organisationType": "energy_software_start_up",
      "originClassification": "africa_built",
      "countryOfOriginIso2": "NG",
      "headquartersCountryIso2": "",
      "lifecycleStatus": "active",
      "website": "https://www.pamafrica.com/",
      "description": "Mini-grid optimisation, smart metering, payments and demand response",
      "providerProfileConfirmed": false,
      "lastCheckedAt": "2026-07-30"
    },
    {
      "id": "org_003",
      "name": "PowerLabs",
      "slug": "powerlabs",
      "organisationType": "energy_software_start_up",
      "originClassification": "africa_built",
      "countryOfOriginIso2": "NG",
      "headquartersCountryIso2": "NG",
      "lifecycleStatus": "active",
      "website": "https://powerlabstech.com/",
      "description": "Energy intelligence software and hardware for orchestrating grid, solar, batteries and generators",
      "providerProfileConfirmed": false,
      "lastCheckedAt": "2026-07-30"
    }
  ],
  "products": [
    {
      "id": "prod_001",
      "organisationId": "org_001",
      "organisation": "Beacon Power Services",
      "name": "CAIMS",
      "slug": "caims",
      "description": "Customer and asset information; network surveys; connections; digital twin",
      "categoryId": "cat_distribution_utility_operations",
      "category": "Distribution utility operations",
      "stageId": "stage_transmit_distribute",
      "originClassification": "africa_built",
      "lifecycleStatus": "active",
      "accessModel": "commercial_proprietary",
      "openSourceUrl": "",
      "website": "https://beaconpowerservices.com/en/solutions/caims",
      "launchedYear": "",
      "lastCheckedAt": "2026-07-30",
      "deploymentCountries": [
        "NG"
      ],
      "evidenceStatuses": [
        "independently_evidenced",
        "provider_claim_only"
      ],
      "capabilities": [
        "Customer and asset information",
        "network surveys",
        "connections",
        "digital twin"
      ]
    },
    {
      "id": "prod_002",
      "organisationId": "org_001",
      "organisation": "Beacon Power Services",
      "name": "Adora",
      "slug": "adora",
      "description": "Grid operations; outage and loss analytics; field work; commercial operations",
      "categoryId": "cat_distribution_utility_operations",
      "category": "Distribution utility operations",
      "stageId": "stage_transmit_distribute",
      "originClassification": "africa_built",
      "lifecycleStatus": "active",
      "accessModel": "commercial_proprietary",
      "openSourceUrl": "",
      "website": "https://beaconpowerservices.com/en/solutions/adora",
      "launchedYear": "",
      "lastCheckedAt": "2026-07-30",
      "deploymentCountries": [
        "NG"
      ],
      "evidenceStatuses": [
        "independently_evidenced",
        "provider_claim_only"
      ],
      "capabilities": [
        "Grid operations",
        "outage and loss analytics",
        "field work",
        "commercial operations"
      ]
    },
    {
      "id": "prod_003",
      "organisationId": "org_001",
      "organisation": "Beacon Power Services",
      "name": "Xepp",
      "slug": "xepp",
      "description": "Consumption insights; payments; customer engagement; distributed solar offers",
      "categoryId": "cat_retail_metering_billing_payments",
      "category": "Retail metering, billing and payments",
      "stageId": "stage_meter_serve",
      "originClassification": "africa_built",
      "lifecycleStatus": "active",
      "accessModel": "public_access",
      "openSourceUrl": "",
      "website": "https://www.beaconpowerservices.com/en/solutions/xepp",
      "launchedYear": "",
      "lastCheckedAt": "2026-07-30",
      "deploymentCountries": [],
      "evidenceStatuses": [
        "independently_evidenced",
        "provider_claim_only"
      ],
      "capabilities": [
        "Consumption insights",
        "payments",
        "customer engagement",
        "distributed solar offers"
      ]
    },
    {
      "id": "prod_004",
      "organisationId": "org_002",
      "organisation": "PAM Africa",
      "name": "PAM-AI",
      "slug": "pam-ai",
      "description": "Real-time monitoring, smart tariffs, remote device control, payment integration and demand response",
      "categoryId": "cat_paygo_minigrid_operations",
      "category": "PAYGo and mini-grid operations",
      "stageId": "stage_meter_serve",
      "originClassification": "africa_built",
      "lifecycleStatus": "active",
      "accessModel": "not_publicly_documented",
      "openSourceUrl": "",
      "website": "https://www.pamafrica.com/",
      "launchedYear": "",
      "lastCheckedAt": "2026-07-30",
      "deploymentCountries": [
        "NG"
      ],
      "evidenceStatuses": [
        "public_source"
      ],
      "capabilities": [
        "Real-time monitoring, smart tariffs, remote device control, payment integration and demand response"
      ]
    },
    {
      "id": "prod_005",
      "organisationId": "org_003",
      "organisation": "PowerLabs",
      "name": "Pai Enterprise",
      "slug": "pai-enterprise",
      "description": "Energy monitoring, analytics, sizing optimisation, anomaly detection and multi-source orchestration",
      "categoryId": "cat_ci_behind_meter",
      "category": "C&I and behind-the-meter",
      "stageId": "stage_meter_serve",
      "originClassification": "africa_built",
      "lifecycleStatus": "active",
      "accessModel": "commercial_service",
      "openSourceUrl": "",
      "website": "https://www.powerlabstech.com/pai-enterprise/software",
      "launchedYear": "2025",
      "lastCheckedAt": "2026-07-30",
      "deploymentCountries": [],
      "evidenceStatuses": [
        "independently_evidenced",
        "provider_claim_only"
      ],
      "capabilities": [
        "Energy monitoring, analytics, sizing optimisation, anomaly detection and multi-source orchestration"
      ]
    }
  ],
  "deployments": [
    {
      "id": "dep_001",
      "productId": "prod_001",
      "countryIso2": "NG",
      "subnationalArea": "Abuja distribution area",
      "customerName": "Abuja Electricity Distribution Company (AEDC)",
      "customerDisclosure": "named",
      "lifecycleStatus": "active",
      "startedYear": "2023",
      "endedYear": "",
      "locationPrecision": "utility_territory",
      "lastCheckedAt": "2026-07-30",
      "evidenceStatus": "independently_evidenced",
      "sourceId": "src_3cbec379ee14aa70"
    },
    {
      "id": "dep_002",
      "productId": "prod_002",
      "countryIso2": "NG",
      "subnationalArea": "Abuja distribution area",
      "customerName": "Abuja Electricity Distribution Company (AEDC)",
      "customerDisclosure": "named",
      "lifecycleStatus": "active",
      "startedYear": "2023",
      "endedYear": "",
      "locationPrecision": "utility_territory",
      "lastCheckedAt": "2026-07-30",
      "evidenceStatus": "independently_evidenced",
      "sourceId": "src_3cbec379ee14aa70"
    },
    {
      "id": "dep_003",
      "productId": "prod_004",
      "countryIso2": "NG",
      "subnationalArea": "",
      "customerName": "Kano Electricity Distribution Company (KEDCO)",
      "customerDisclosure": "named",
      "lifecycleStatus": "active",
      "startedYear": "2025",
      "endedYear": "",
      "locationPrecision": "country",
      "lastCheckedAt": "2026-07-30",
      "evidenceStatus": "public_source",
      "sourceId": "src_91c1fac8b3e57eb7"
    },
    {
      "id": "dep_004",
      "productId": "prod_004",
      "countryIso2": "NG",
      "subnationalArea": "",
      "customerName": "",
      "customerDisclosure": "undisclosed",
      "lifecycleStatus": "active",
      "startedYear": "2025",
      "endedYear": "",
      "locationPrecision": "country",
      "lastCheckedAt": "2026-07-30",
      "evidenceStatus": "public_source",
      "sourceId": "src_91c1fac8b3e57eb7"
    }
  ],
  "sources": [
    {
      "id": "src_3cbec379ee14aa70",
      "url": "https://proparco.fr/en/news/beacon-power-services-harnessing-data-drive-africas-energy-transition",
      "title": "Beacon Power Services: harnessing data to drive Africa’s energy transition",
      "publisher": "Proparco — AFD Group",
      "sourceType": "dfi_report",
      "publicationDate": "2026-04-23",
      "retrievedAt": "2026-07-30",
      "archivedUrl": "",
      "sourceLicense": "all_rights_reserved; factual_metadata_and_linking_only",
      "independenceClass": "customer_or_official",
      "automationPermitted": false,